{
  "$schema": "http://json-schema.org/draft-07/schema#",
  "$id": "https://github.com/procoders/superpowers-v/schemas/job_result.schema.json",
  "title": "Compound V job_result",
  "description": "Canonical, backend-independent result of one dispatched job. Identical shape across the claude, codex, and antigravity adapters. The enforcement fields (blocked, files_changed, violations) are GIT-DERIVED by the caller, never self-reported by the worker model; the model's --output-last-message text feeds only `summary`. Also usable as a codex `--output-schema` target.",
  "type": "object",
  "additionalProperties": false,
  "required": [
    "status",
    "blocked",
    "files_changed",
    "violations",
    "summary",
    "session_id",
    "worktree",
    "exit_code",
    "failure_class",
    "retry_after_seconds"
  ],
  "allOf": [
    {
      "if": {
        "properties": {
          "status": {
            "enum": [
              "success",
              "blocked"
            ]
          }
        },
        "required": [
          "status"
        ]
      },
      "then": {
        "not": {
          "anyOf": [
            {
              "required": [
                "retry_at"
              ]
            },
            {
              "required": [
                "network_scope"
              ]
            }
          ]
        }
      }
    }
  ],
  "properties": {
    "status": {
      "type": "string",
      "enum": [
        "success",
        "blocked",
        "timeout",
        "error"
      ],
      "description": "Terminal disposition of the job. `blocked` means a scope violation; `timeout` means the timeout wrapper fired; `error` is any other non-zero exit."
    },
    "blocked": {
      "type": "boolean",
      "description": "True if any file outside write_allowed changed. Git-derived by the scope gate, never model-self-reported. When true, status MUST be `blocked` and the caller MUST NOT merge."
    },
    "files_changed": {
      "type": "array",
      "items": {
        "type": "string"
      },
      "description": "Repo-relative paths the job actually changed: `git diff --name-only` UNION `git ls-files --others --exclude-standard` inside the worktree (or against the baseline commit for direct jobs)."
    },
    "violations": {
      "type": "array",
      "items": {
        "type": "string"
      },
      "description": "Subset of files_changed that fall outside write_allowed. Non-empty \u21d2 blocked. Git-derived."
    },
    "summary": {
      "type": "string",
      "description": "Human-readable one-paragraph summary. Sourced from --output-last-message (or the schema'd JSON) \u2014 informational only, never used for enforcement."
    },
    "session_id": {
      "type": "string",
      "description": "Backend session/run identifier for resume. For codex: the UUID captured from the first `--json` `thread.started` event's `thread_id` (UUID-validated), resumed via `codex exec resume <uuid>` only under the resume-eligibility rule. Empty string when the backend has no resumable session."
    },
    "worktree": {
      "type": "string",
      "description": "Absolute path of the worktree the job ran in, or empty string for `direct` (in-place) jobs. Worktrees live under $TMPDIR/compound-v/<run-id>/<job-id>."
    },
    "exit_code": {
      "type": "integer",
      "description": "Raw process exit code of the worker (0 on success; 124 if the timeout wrapper fired)."
    },
    "failure_class": {
      "type": [
        "string",
        "null"
      ],
      "enum": [
        null,
        "none",
        "out_of_credits",
        "rate_limited",
        "overloaded",
        "usage_window_exhausted",
        "model_unavailable",
        "auth",
        "context_length",
        "timeout",
        "network",
        "other"
      ],
      "description": "On a non-success status, the classified backend-failure reason from compound-v-classify-failure.py (out_of_credits | rate_limited | overloaded | usage_window_exhausted | model_unavailable | auth | context_length | timeout | network | other). null on success/blocked. Drives the dispatcher's deterministic retry/reroute/halt policy."
    },
    "retry_after_seconds": {
      "type": "integer",
      "minimum": 0,
      "description": "Seconds-until-retry parsed from the provider message (HTTP Retry-After, or a codex usage-limit countdown like 'try again in 5 days'), 0 when unknown. The dispatcher passes this to compound-v-failure-policy.py --retry-after so a retry honors the provider's stated wait instead of synthetic backoff."
    },
    "retry_at": {
      "type": [
        "string",
        "null"
      ],
      "format": "date-time",
      "description": "OPTIONAL absolute provider retry/reset instant in RFC3339 form, normalized to aware UTC by compound-v-provider-time.py. Omitted on success/blocked; null only when an error-producing transport explicitly carries the field but has no absolute hint."
    },
    "network_scope": {
      "type": [
        "string",
        "null"
      ],
      "enum": [
        null,
        "no_response",
        "provider_reported"
      ],
      "description": "OPTIONAL network evidence scope. no_response means no valid provider response arrived and may contribute to bounded cross-provider correlation; provider_reported means the provider returned a network-class error and cannot prove common-path internet loss. Omitted on success/blocked."
    },
    "usage": {
      "type": "object",
      "additionalProperties": false,
      "description": "OPTIONAL, INFORMATIONAL, MEASURED-ONLY token/advisor accounting for this job. Worker-sourced like `summary` (extracted from the backend's own structured usage events by compound-v-usage-extract.py), NEVER fabricated and NEVER used for enforcement. When a backend emits no machine-readable usage (agy/antigravity, claude Task subagent, devin) or the events log is missing/unparseable, `measured` is false and the token counts are null (anti-ruflo: a null is honest, a made-up number is not). Omitted entirely when the worker provided no usage object.",
      "properties": {
        "input_tokens": {
          "type": ["integer", "null"],
          "description": "Total input/prompt tokens consumed by the job, summed across the backend's usage events. null when not measured."
        },
        "output_tokens": {
          "type": ["integer", "null"],
          "description": "Total output/completion tokens produced by the job, summed across the backend's usage events. null when not measured."
        },
        "advisor_calls": {
          "type": ["integer", "null"],
          "description": "Number of times the executor actually consulted the read-only advisor subagent. Worker-COUNTED (not derived from CLI turn/iteration counts), set by the advisor worker, not by the usage extractor. null when unknown or not applicable."
        },
        "backend": {
          "type": "string",
          "description": "Backend name this usage was extracted for (codex | opencode | cursor | agy | antigravity | claude | devin | zai)."
        },
        "measured": {
          "type": "boolean",
          "description": "True only when real token counts were extracted from the backend's structured usage events. False when the backend emits no machine-readable usage or the events log was absent/empty/unparseable; in that case the token counts are null."
        }
      }
    }
  }
}
