{
  "status": "success",
  "blocked": false,
  "files_changed": [
    "GEMINI.md",
    "AGENTS.md",
    "TROUBLESHOOTING.md",
    "skills/compound-v/rationalization-table.md",
    "assets/skyscraper-metaphor.md",
    "commands/v-remember.md",
    "skills/compound-v/memory.md",
    "commands/v-init.md"
  ],
  "violations": [],
  "summary": "GEMINI four transitions + item 0 + Gemini 3.1 + 2 command rows; AGENTS 0.144.1 + rows + xhigh note; TROUBLESHOOTING Trigger-0 section with plain-language recon ask; rationalization rows; metaphor 1C note; recon in V-memory prose; v-init fail-closed byte-match. Scope PASS.",
  "session_id": "",
  "worktree": "/private/tmp/compound-v/2026-07-11-v2-8-hardening/task-7-staleness",
  "exit_code": 0,
  "failure_class": null,
  "retry_after_seconds": 0
}